Locuteur,Echange
ch_NS3:,donc en fait on on débute en
ch_NS3:,en demandant aux gens depuis combien
ch_NS3:,de temps est-ce qu'ils euh
ch_NS3:,habitent à Orléans
ch_NS3:,pour afin d'avoir d'une idée de leur euh
LD54:,quand vous dites Orléans euh Orléans même ?
ch_NS3:,euh leur parcours de vie euh
LD54:,ou la banlieue d'Orléans ?
ch_NS3:,[bb:noise:instantaneous] euh ben
ch_NS3:,les deux en fait hein savoir un petit peu euh
LD54:,bon
LD54:,je suis natif euh d'une ville
LD54:,qui se trouve euh à trente kilomètres d'Orléans
ch_NS3:,hm hm
LD54:,et je suis rentré euh
LD54:,j'habitais Fleury-les-Aubrais
LD54:,dans les y a environ maintenant euh
LD54:,trente-cinq ans
LD54:,[bb:noise:instantaneous]
LD54:,bon je suis Orléanais hein
LD54:,j'ai fait
LD54:,mes achats euh
LD54:,au cours de ma jeunesse
LD54:,je l'ai passé à Orlé- aussi à Orléans
LD54:,donc euh après
ch_NS3:,hm hm
LD54:,je suis parti sur Paris
LD54:,travailler
LD54:,comme beaucoup de jeunes hein
LD54:,et je suis revenu euh re-
LD54:,je suis rentré su- de nouveau sur Orléans
LD54:,vers les vingt-cinq ans
LD54:,vingt-six ans
ch_NS3:,hm hm
LD54:,et depuis donc euh je suis Orléanais
LD54:,sachant que j'ai travaillé
LD54:,sur Orléans pendant dix ans
LD54:,pendant quinze ans je me suis expro- euh
LD54:,je suis
LD54:,retourné travailler sur Chartres
LD54:,donc Chartres c'est la banlieue d'Orléans entre guillemets
ch_NS3:,hm hm
LD54:,mais toujours en habitant euh
LD54:,Semoy
LD54:,on habite Semoy
LD54:,donc Semoy c'est un petit village qui se trouve euh
LD54:,accolé à Orléans
ch_NS3:,hm hm
LD54:,au nord d'Orléans
ch_NS3:,hm hm
LD54:,donc je suis natif d'Orléans
LD54:,Olivet
ch_NS3:,d'accord
LD54:,et donc je suis maintenant Orléanais pur
LD54:,euh depuis
LD54:,que nous sommes commerçants
LD54:,rue NANON depuis trois ans et demi
ch_NS3:,hm hm
LD54:,sachant qu'on n'habite pas ici
LD54:,on pourrait habiter ici
LD54:,mais on habite toujours notre pavillon à Semoy
ch_NS3:,d'accord
ch_NS3:,ah vous avez repris le commerce ici
ch_NS3:,mais vous avez gardé votre euh
ch_NS3:,ce qui est logique euh
LD54:,on a gardé notre euh notre on a gardé
LD54:,non encore que euh
LD54:,[i:noise:instantaneous]
LD54:,pour certains euh
LD54:,pour certains ils trouvent euh
LD54:,moi je suis pas d'accord
LD54:,habiter sur place c'est plus pratique c'est vrai
LD54:,quand on habite très loin
LD54:,mais nous on est à dix mi- mi- minutes
LD54:,euh en voiture
ch_NS3:,hm hm
LD54:,de de où on habite
LD54:,on préfère habiter euh
LD54:,où nous sommes euh
LD54:,sans changer nos habitudes
LD54:,mais c'est vrai que
LD54:,quand vous avez un commerce bon je revire
LD54:,je parle maintenant du commerce
LD54:,quand vous avez un commerce avec un logement
LD54:,c'est très recherché aujourd'hui
LD54:,surtout pour un tabac-presse
LD54:,donc aujourd'hui apparemment on on sait
LD54:,dans le futur
LD54:,on pense pas qu'on aura de mal à trouver un repreneur
LD54:,parce que euh
ch_NS3:,hm hm
LD54:,ce genre de métier de services
LD54:,c'est quand même
LD54:,prenant
LD54:,on est quand même euh
LD54:,en activité du matin sept heures trente
LD54:,jusqu'à vingt heures le soir
LD54:,donc c'est quand même euh six jours par semaine
ch_NS3:,hm hm
LD54:,et une famille aujourd'hui
LD54:,nous nous sommes relativement âgés
LD54:,mais une famille de trente-cinq ans
LD54:,qui ont des enfants
LD54:,c'est l'idéal de d'habiter sur place
LD54:,sachant que euh
ch_NS3:,hm hm
LD54:,la femme peut très bien euh s'occuper des enfants euh
LD54:,et être à la boutique euh en cas de besoin
ch_NS3:,ouais ouais
ch_NS3:,et donc qu'est-ce qui vous a amené à rester à
ch_NS3:,à Orléans
ch_NS3:,parce que vous m'avez dit que vous êtes euh
ch_NS3:,parti sur Paris vous auriez
ch_NS3:,pu rester euh
LD54:,non non Paris à j-
LD54:,Paris c'était ma ma jeunesse
LD54:,au début euh les premiers emplois on les trouve sur Paris
ch_NS3:,hm hm
LD54:,après je me suis rapproché sur Saint-Jean-de-Braye
LD54:,dans dans mon métier
LD54:,donc j'ai activé
LD54:,j'étais en activité pendant onze ans
LD54:,sur Saint-Jean-de-Braye
LD54:,et après
LD54:,à trente-cinq ans
LD54:,comme tout le monde à trente cinq ans
LD54:,on a envie de progresser on a voulu prendre euh
LD54:,un petit peu plus de responsabilité
LD54:,et j'ai trouvé un poste similaire à celui que j'avais
LD54:,sur Orléans sur Chartres
LD54:,et à l'époque euh on était en train de construire
LD54:,notre maison sur Sain- sur sur Semoy
LD54:,donc ça a été un accord avec mon épouse
LD54:,euh on reste sur Orléans
LD54:,on va pas habiter Chartres
LD54:,parce que Chartres on connaît Chartres
LD54:,mais pas pour y habiter
LD54:,on reste sur Orléans
LD54:,et je fais euh la navette
LD54:,tous les jours euh Chartres Orléans
LD54:,donc euh
ch_NS3:,hm hm
LD54:,donc Paris au tout
LD54:,au tout début
LD54:,Chartres euh Orléans
LD54:,Chartres
LD54:,j'aurais pu être encore resté à Chartres aujourd'hui
LD54:,mais aujourd'hui bah j'ai
LD54:,j'ai arrêté de travailler sur Chartres
LD54:,et aujourd'hui à Orléans
LD54:,parce que euh
LD54:,pourquoi Orléans si on a voulu prendre un commerce euh
LD54:,autant chercher un commerce dans notre région
LD54:,sachant qu'on avait un logement proche
ch_NS3:,hm hm
LD54:,on voulait pas du tout s'exproprier
LD54:,euh très loin
LD54:,pour avoir des loyers à payer et et
LD54:,pour dire plus on est on est
LD54:,on est d'Orléans et quand on fait une étude de marché
LD54:,on connaissait bien Orléans la rue NANON
LD54:,j'ai fait une étude de marché
LD54:,donc aujourd'hui c'est plus facile
LD54:,de faire une étude de marché quand on est sur place
LD54:,que quand on est à
LD54:,quand on prend un commerce à cinq kilomètres
ch_NS3:,hm hm
LD54:,donc aujourd'hui l'intérêt c'était
LD54:,de cibler
LD54:,un commerce sur Orléans
LD54:,et ça m'a permis euh avant de m'engager à
LD54:,prendre ce commerce
LD54:,de suivre un peu l'évolution de ce commerce où nous sommes
LD54:,bon aujourd'hui ça se passe comme ça
LD54:,il faut faire un peu de marketing hein
LD54:,hein
ch_NS3:,hm hm
ch_NS3:,ah oui on voit tellement de
LD54:,pour voir
ch_NS3:,de magasins
ch_NS3:,qui ferment qui ouvrent et qui ferment
ch_NS3:,quelques mois après que
LD54:,oui bon pour un buraliste euh
LD54:,un tabac pour euh un un service de hm
LD54:,[bb:noise:instantaneous]
LD54:,de prestation de services
LD54:,c'est pas encore des produits
LD54:,qui ferment
LD54:,ça veut dire y a toujours un besoin
LD54:,bon dans dix ans
LD54:,on sait pas comment ça se passera
LD54:,mais on va dire aujourd'hui on a encore quelques années à
LD54:,pouvoir vivre hein
LD54:,mais c'est vrai que euh
ch_NS3:,hm hm
LD54:,j'aurais trente-cinq ans je me serais pas du tout
LD54:,mis dans ce genre de
LD54:,d'activité hein
LD54:,hein
LD54:,j'étais salarié pendant trente ans
LD54:,donc euh c'était là je suis plutôt en train
LD54:,d'attendre euh entre guillemets
LD54:,de compléter mes points de retraite
LD54:,en étant indépendant
ch_NS3:,hm hm
LD54:,mais aussi le l-
LD54:,comment je on envisage la suite de l'avenir
LD54:,en cotisant encore cinq six ans
LD54:,pour pouvoir prendre notre retraite
LD54:,et en étant indépendant
LD54:,et plus salarié
ch_NS3:,hm d'accord
LD54:,avec moins de euh
LD54:,moins de contraintes
LD54:,des contraintes
LD54:,d'horaires certes
LD54:,mais bon on s'y habitue
LD54:,mais moins de contraintes de responsab-
LD54:,de responsabilités
LD54:,de de de stress euh
LD54:,parce qu'aujourd'hui on parle beaucoup du stress
ch_NS3:,hm hm
LD54:,c'est vrai que je pense aujourd'hui
LD54:,que les les salariés dans les entreprises euh
LD54:,sont souvent stressés hein
LD54:,et arriver
LD54:,quand vous avez un âge relativement avancé
LD54:,vous passez quand même
LD54:,bon vous êtes relativement jeune
LD54:,donc vous avez pas du tout ce
LD54:,[rire en fond:noise:instantaneous] ce contexte
LD54:,mais j'ai connu
LD54:,euh j'ai connu une activité à trente-cinq ans
LD54:,dans l'entreprise
LD54:,que je suis rentré
LD54:,sur Chartres
LD54:,j'y suis resté jusqu'à cinquante ans
LD54:,bon euh
LD54:,et j'ai vu
LD54:,moi-même
LD54:,euh à quarante-cin- à quarante-cinq ans
LD54:,commencer euh à
LD54:,tirer un peu en- entre guillemets
LD54:,[bb:noise:instantaneous] sur des gens qui avaient la cinquantaine passée
LD54:,parce que ils avaient peut-être une
LD54:,façon de travailler différente
LD54:,et aujourd'hui c'est vrai que
ch_NS3:,hm hm
LD54:,on doit peut-être s'adapter
LD54:,et même si on s'adapte
LD54:,on est quand même euh
LD54:,déconnecté par rapport aux gens de trente-cinq quarante ans
LD54:,euh à une personne qui a cinquante-cinq ans
LD54:,euh
LD54:,elle est vieille
LD54:,hein aujourd'hui quand vous voyez des enfants euh
LD54:,de de de de douze ans
LD54:,quand ils voient quelqu'un de quarante ans euh
ch_NS3:,hm hm
LD54:,il est vieux hein l'institutrice euh
LD54:,un gamin de douze ans
LD54:,va vous dire la maîtresse c'est une vieille
LD54:,et elle a trente-cinq quarante ans
ch_NS3:,hm hm
LD54:,n'est-ce pas ?
ch_NS3:,hm hm
ch_NS3:,[rire:noise:instantaneous]
ch_NS3:,oui c'est vrai sur le
ch_NS3:,[rire:noise:instantaneous]
ch_NS3:,la perception est différente selon l'âge
LD54:,et donc moi j'ai bien euh
LD54:,je me suis bien rendu compte euh
LD54:,quand j'avais trente-cinq quarante ans
LD54:,que j'avais des personnes dans dans mon service
LD54:,qui étaient
LD54:,pas plus âgées
LD54:,qu'aujourd'hui je su- je le suis
LD54:,mais euh ça commence
LD54:,on on dit
LD54:,bon euh cette personne-là
LD54:,elle devrait se remettre en question euh
LD54:,pas pour autant dire que
LD54:,faut les mettre euh
LD54:,dehors loin de là
LD54:,mais malheureusement euh
LD54:,qu'est-ce qui se produit aujourd'hui dans les entreprises
LD54:,c'est souvent
LD54:,quand vous avez euh la la cinquantaine passée euh
LD54:,vous êtes relativement cher
LD54:,comme on dit aujourd'hui
LD54:,on lit des romans des journaux
LD54:,donc aujourd'hui je connais bien la presse
LD54:,je connais bien les
LD54:,[rire:noise:instantaneous]
LD54:,hm hm
ch_NS3:,qu'est-ce qu'on parle aujourd'hui
ch_NS3:,de la retraite euh et des retraites
ch_NS3:,c'est vrai que une
ch_NS3:,personne de cinquante-cinq ans
ch_NS3:,peut coûter plus cher euh
ch_NS3:,qu'un jeune de trente-cinq ans
ch_NS3:,qui est
ch_NS3:,muni de bagages
ch_NS3:,voire supérieurs
ch_NS3:,bon c'est comme ça
LD54:,hm hm
LD54:,oui malheureusement
LD54:,enfin la personne jeune a moins d'expériences que le
LD54:,la personne plus âgée mais
LD54:,c'est vrai qu'on a quand même tendance à
ch_NS3:,bon du du fait que c'est anonyme apparemment votre euh
LD54:,à se débarrasser de plus de
ch_NS3:,c'est anonyme plus ou moins
LD54:,oui
ch_NS3:,oui oui tout sera anonymé
LD54:,donc euh je croyais
LD54:,je croyais j'étais j'étais cadre euh
LD54:,donc avant d'être ici
ch_NS3:,donc euh
ch_NS3:,hm hm
LD54:,j'étais chef de service
LD54:,en recherche et développement
LD54:,euh je pensais
LD54:,que l'expérience était
LD54:,un atout
LD54:,l'expérience est un atout
LD54:,quand vous êtes en place
LD54:,mais quand vous êtes plus en place
LD54:,pour des raisons euh économiques euh
LD54:,licenciement économique
LD54:,quand vous êtes euh hors circuit
LD54:,vous avez toujours votre savoir-faire
LD54:,hein
LD54:,l'expérience
ch_NS3:,hm hm
LD54:,mais l'employeur qui vous embauche
LD54:,euh il voudrait vos expériences
LD54:,mais il voudrait que vous soyez dix ans plus jeune
LD54:,et donc j'ai été euh amené
LD54:,à comprendre euh à comprendre à subir ce phénomène
LD54:,de gens qui vous voulaient
LD54:,quand vous étiez déjà en place
LD54:,quand vous êtes euh
LD54:,sorti du circuit
LD54:,du système
LD54:,on est surpris de voir
LD54:,que sur votre CV
LD54:,que vous avez autant d'âge
LD54:,et bon alors vous a- donc vous allez donc avoir
LD54:,des entretiens
LD54:,donc aujourd'hui vous avez bon faut pas dire
LD54:,j'ai vu dans les journaux
LD54:,des gens qui envoient cent CV
LD54:,ils ont euh trois réponses
LD54:,si le CV est mal fait et si euh
LD54:,ils dirigent pas leur CV
LD54:,euh sur des emplois qui leur sont tout à fait possibles
LD54:,dans ces cas-là on peut faire ce qu'on veut
LD54:,mais quand vous avez bien ciblé
LD54:,vos emplois quand vous envoyez ces CV
LD54:,vous avez quand même
LD54:,assez souvent des
LD54:,des des entretiens
LD54:,des contacts
ch_NS3:,hm hm
LD54:,des entretiens
LD54:,et souvent l'entretien se termine euh
LD54:,au bout du deuxième ou du troisième euh
LD54:,parce que c'est plus ou moins euh l'âge
LD54:,hein euh l'expérience c'est une chose
LD54:,mais ils se disent peut-être euh
LD54:,la personne qui aura trente-cinq ans
LD54:,ou quarante ans
ch_NS3:,hm hm
LD54:,aura peut-être la même expérience
LD54:,que la personne qui en a cinquante
LD54:,un petit peu moins
LD54:,donc quand on a je pense
LD54:,l'expérience à quarante-cinq ans
LD54:,à quarante ans
LD54:,on a l'expérience similaire à cinquante ans
LD54:,moi je dis que le savoir-faire
LD54:,vous l'avez à quarante ans et vous l'avez
LD54:,pas plus à cinquante
ch_NS3:,hm hm
LD54:,donc c'est pour ça
LD54:,que l'expérience compte
LD54:,l'expérience compte mais à
LD54:,quarante ans les gens ont l'expérience
LD54:,bon
LD54:,je parle pas de gens de vingt-cinq ans hein
LD54:,loin de là
ch_NS3:,hm hm
ch_NS3:,d'accord
ch_NS3:,et justement pour continuer sur votre euh
ch_NS3:,sur votre métier euh
ch_NS3:,qu'est-ce qui vous a
ch_NS3:,poussé quand vous étiez
ch_NS3:,jeune euh
ch_NS3:,à
ch_NS3:,travailler dans la
ch_NS3:,la recherche et le développement enfin quel est le parcours que vous avez
ch_NS3:,fait au niveau
ch_NS3:,des études euh
LD54:,donc euh j'étais en parfumerie
LD54:,donc euh parce que bon
LD54:,je ne faisais pas des moteurs d'avion
LD54:,mais c'est un métier très spécifique euh la parfumerie
LD54:,donc R et D ça veut dire euh donc euh
LD54:,j'ai été amené euh bon j'ai un bac plus deux
LD54:,en mécanique générale
LD54:,donc en mécanique appliquée donc euh
LD54:,après euh vous avez vingt-cinq ans
LD54:,vous faites vous commencez comme tout le monde euh
LD54:,avec vo- les premiers
LD54:,dans les années
LD54:,dans les années
LD54:,soixante-quinze quatre-vingts
LD54:,les années quatre-vingts
LD54:,soixante-quinze
LD54:,quatre- soixante-quinze quatre-vingts
LD54:,vous commencez à travailler
LD54:,tous dans des bureaux d'études
ch_NS3:,hm hm
LD54:,bon j'étais dessinateur
LD54:,donc aujourd'hui euh on commence
LD54:,à dessiner étude un étude deux
LD54:,et à vingt-cinq vingt-six vingt-sept ans
LD54:,où vous av-
LD54:,vous êtes sur Paris et vous avez
LD54:,l'opportunité de de voir des postes
LD54:,qui se créent sur Orléans
LD54:,qui sont pas tout à fait
LD54:,dans votre profession
LD54:,mais vous dites euh je suis capable de faire
LD54:,ce genre de euh
LD54:,de de métier
LD54:,donc le développement la qualité
LD54:,c'est quelque chose euh
LD54:,que je connaissais déjà un petit peu
LD54:,et bon vous rentrez donc je suis rentré
LD54:,dans une société
LD54:,je suis rentré chez un grand parfumeur d'Orléans
LD54:,à Saint-Jean-de-Braye
LD54:,et donc vous faites votre carrière euh
LD54:,vous donnez votre savoir-faire euh
LD54:,vous faites euh de la qualité vous faites un peu de développement
LD54:,quand on est technicien
LD54:,on fait du développement sans le savoir
LD54:,et vous vous rendez compte
LD54:,que vous avez des capacités
LD54:,et quand vous avez trente-cinq ans
LD54:,vous êtes euh ads-
LD54:,adjoint à un chef de service éventuellement
LD54:,c'était mon cas
LD54:,vous avez à trente-cinq ans l'opportunité
LD54:,de voir euh un de vos concurrents
LD54:,[cocurrents:pronounce:instantaneous] euh
LD54:,qui cherche euh un responsable développement
LD54:,et donc euh vous vous postulez
LD54:,et vous êtes embauché
LD54:,et après vous poursuivez cette carrière hein
ch_NS3:,hm hm
LD54:,avec une structure euh
LD54:,ingénieur développement euh
LD54:,technicien qualité
LD54:,et on fait ça pendant quinze ans
ch_NS3:,hm hm
LD54:,avec euh aujourd'hui un métier
LD54:,très plaisant
LD54:,donc euh
LD54:,c'est bon aujourd'hui quand on fait la parfumerie
LD54:,ça veut dire en développement ça veut dire
LD54:,que vous prenez l'exemple
LD54:,ou vous rencontrez une marketing
LD54:,qui va vous dire c'est
LD54:,pas du tout un développement
LD54:,commande notre
LD54:,[pi:pronounce:instantaneous]
LD54:,vous avez un marketing euh
LD54:,qui va vous donner euh une estis-
LD54:,euh l'esquisse d'un d'un flac- de de
LD54:,d'un parfum
LD54:,eux ils font le brief marketing de leur côté
LD54:,bon c'est
LD54:,leur façon de travailler
LD54:,et ils vous sortent une maquette
LD54:,qu'ils font euh avec euh
LD54:,du papier du carton
LD54:,quelque chose
LD54:,qui est souvent imaginable hein c'est c- c'est leur idée
LD54:,vous la désossez
LD54:,et après
LD54:,vous la dé- vous dé- vous vous
LD54:,v- vous prenez le projet
LD54:,vous voyez s'il est viable ou pas
LD54:,s'il est f-
LD54:,s'il est ré-
LD54:,pardon s'il est réalisable ou pas
LD54:,en industrie
ch_NS3:,hm hm
LD54:,et après donc euh
LD54:,vous le disséquez en morceaux
LD54:,et vous savez
LD54:,que vous avez un flacon
LD54:,vous avez une capsule un bouchon
LD54:,un packaging un emballage et après euh
LD54:,après vous êtes amené à
LD54:,à pondre le projet
LD54:,et et après
LD54:,à définir le prix
LD54:,puisqu'on est t- on est plutôt R et D achat
LD54:,définir le produit
LD54:,voir si ça passe
LD54:,en prix
LD54:,par rapport euh
LD54:,par rapport euh au coût
LD54:,du produit
LD54:,à la marge
LD54:,par rapport à ce que le marketing euh
LD54:,estime euh le vendre
LD54:,et les commerciaux
LD54:,et après donc euh vous lancez
LD54:,vous vous faites des maquettes
LD54:,vous lancez les outillages
LD54:,et vous faites aussi bien
LD54:,du flacon donc bon il faut être un spécialiste
LD54:,du flacon
LD54:,du plastique
LD54:,donc du verre
LD54:,du plastique
ch_NS3:,hm hm
LD54:,et du l'étayage
LD54:,du pa- du carton
ch_NS3:,d'accord
LD54:,donc c'est comme ça
LD54:,qu'on fait des
LD54:,des flacons ou des lignes de soin
ch_NS3:,hm hm
LD54:,donc je
LD54:,[pi:pronounce:instantaneous]
LD54:,je conseille uniquement au niveau du
LD54:,du contenant
LD54:,donc je vais pas
LD54:,en R et D
LD54:,au niveau recherche euh formulation
LD54:,donc uniquement au niveau du concept des
LD54:,du contenant comme on dit
LD54:,du du packaging
LD54:,proprement dit
ch_NS3:,hm hm
ch_NS3:,et donc en fait c'est le
ch_NS3:,les gens du
ch_NS3:,du contenant ou du contenu
ch_NS3:,qui qui commencent en premier euh
ch_NS3:,ou les deux sont mélangés euh
ch_NS3:,c'est un
ch_NS3:,flacon qui va déclencher quelque chose
ch_NS3:,ou c'est
ch_NS3:,déjà un parfum ou un produit qui est prêt
ch_NS3:,qui va demander un
LD54:,le parfum
LD54:,reprenons le parfum le parfum
LD54:,c'est souvent des comment di-
LD54:,c'est pas donné
LD54:,[dénné:pronounce:instantaneous] aujourd'hui
LD54:,malheureuse- m-
LD54:,même aujourd'hui
LD54:,de plus en plus
LD54:,de- depuis lon- depuis longtemps
LD54:,on fait appel à des organismes extérieurs
LD54:,qui font
LD54:,des panels de parfum
LD54:,qui le présentent en marketing
LD54:,donc aujourd'hui le marketing
LD54:,va dire le chef du projet au marketing euh
LD54:,ou le directeur marketing va dire
LD54:,ce parfum je le trouve un
LD54:,p- un peu trop fruité
LD54:,pas assez fruité un peu plus
LD54:,ou je voudrais un peu plus d'ambré
LD54:,je voudrais un peu plus de ci un peu plus de ça
ch_NS3:,hm hm
LD54:,donc il amène des panels
LD54:,euh ça se passe des fois
LD54:,ils partent avec cent panels de de parfum
LD54:,qu'ils testent sur des mouillettes
LD54:,ça se passe comme ça hein encore
LD54:,et sur les
LD54:,après il n'en reste plus qu'une quinzaine
LD54:,et après ils demandent de travailler les quinze parfums
LD54:,ou les ils ont à peu près leur le
LD54:,leur idée je pense que des fois euh la senteur
LD54:,peut varier en fonction de ce qu'on leur présente
LD54:,ils sont pas très fixés au début
ch_NS3:,hm
LD54:,ils ont
LD54:,une idée
LD54:,et ça peut très bien changer un tout petit peu
LD54:,euh voire même beaucoup
LD54:,euh
LD54:,en fin
LD54:,de d'expérimentation
LD54:,parce que des fois la date du timing avance
LD54:,et des fois euh
LD54:,ils ont pas trouvé
LD54:,des fois euh ce qu'ils veulent
LD54:,et après des fois
LD54:,ils prennent un petit peu
LD54:,euh quelque chose de différent
LD54:,y a un timing qui est prévu
LD54:,et si euh le parfum n'est pas
LD54:,n'est pas arrêté
LD54:,ça sortira pas en développement
LD54:,et c'est après
LD54:,nous on
LD54:,on s'accroche et derrière sur
LD54:,même d- en même temps
LD54:,on s'accroche bien avant eux
LD54:,hein
LD54:,sur le concept du flacon
LD54:,qui ont déjà une idée hein
LD54:,hein le concept du flacon
LD54:,et quand on fait un parfum
LD54:,derrière il faut faire euh la ligne complémentaire
LD54:,qui est aussi bien
LD54:,euh la ligne de soins
LD54:,euh bon les savons ça ne se fait plus euh
LD54:,le gel le lait et tous les produits
LD54:,si c'est un produit masculin ou féminin donc on fait on
ch_NS3:,hm hm
LD54:,y a pas que le f- y a
LD54:,le produit
LD54:,basique
LD54:,mais après on décline toute la ligne derrière
LD54:,et c'est souvent le plus compliqué
LD54:,et c'est souvent ça
LD54:,que le marketing euh va vous le définir
LD54:,coup par coup
LD54:,parce que euh
LD54:,ils se rendent compte
LD54:,que des fois sur un linéaire
LD54:,quand vous lancez un parfum
LD54:,il faut avoir un ligne complète
LD54:,si vous avez que deux étuis un cinquante M L
LD54:,et un cent M L ça va pas
LD54:,il faut le cinquante
LD54:,le cent le trente après y a les compagnies aériennes
LD54:,y a tout l'export qui a besoin de produits
ch_NS3:,hm hm
LD54:,et
LD54:,sur euh un concept d'un parfum avec un packaging
LD54:,propre
LD54:,vous en déclinez tout de suite une douzaine
LD54:,hein
ch_NS3:,hm hm
LD54:,bon c'est comme ça qu'on travaille
ch_NS3:,d'accord
ch_NS3:,ouais ça devait être euh
ch_NS3:,intéressant et
ch_NS3:,motivant euh hm hm
LD54:,non non c'est très c'est très motivant moi je
LD54:,je travaillais chez à Chartres chez Paco Rabanne
LD54:,euh je travaillais en direct avec Paco Rabanne
LD54:,donc euh hm
LD54:,bon
LD54:,vous avez connu euh ultra violet
LD54:,peut-être que vous avez déjà été amenée à
LD54:,acheter ultra violet
LD54:,un flacon en forme de sphère
ch_NS3:,bah ça me dit quelque chose
LD54:,on appuie sur le produit et euh la coque
ch_NS3:,hm hm
LD54:,c'est une demi sphère
LD54:,et la coque est métallique
LD54:,et vous savez un silicone
LD54:,vous avez un genre de soufflet un silicone quelque chose
LD54:,et vous appuyez dessus donc cette euh
LD54:,et
LD54:,Paco Rabanne
LD54:,quand il nous a pon- euh
LD54:,pondu cè- cette idée son premier brief
LD54:,c'était je veux un flacon
LD54:,rond
LD54:,c'était lui qui avait fait Calandre
LD54:,Calandre c'était une ligne qu'il avait fait auparavant
LD54:,chez Paco Rabanne
LD54:,c'était une ligne très
LD54:,très anguleuse
LD54:,et il avait dit
LD54:,je veux un flacon anti-Calandre
LD54:,ça veut dire
LD54:,faut vite comprendre ce qu'il veut
LD54:,ça veut dire il voulait en réalité un flacon
LD54:,il nous a
LD54:,fait comprendre qu'il voulait autre chose
ch_NS3:,hm hm
LD54:,donc et c'était euh une sphère
LD54:,donc euh c'était il était parti dans des idées intré-
LD54:,bon je vais pas en parler mais très très
LD54:,très confondeu-
LD54:,très confuses
LD54:,et c'est de là
LD54:,qu'on a fait un flacon en demi sphère hein
LD54:,donc euh
LD54:,et après
LD54:,donc euh le concept euh il fallait appuyer sur le flacon comme ça
LD54:,donc y avait vraiment des des des concepts euh
LD54:,de
LD54:,Paco Rabanne était très on était très à l'époque
LD54:,très innovant
LD54:,c'était un peut-ê-
LD54:,peut-être le moyen
LD54:,encore maintenant
LD54:,le moyen de se
LD54:,démarquer par rapport
LD54:,au grand groupe LVMH
LD54:,qui faisait des flacons plutôt basiques
LD54:,donc nous il fallait faire des flacons
LD54:,qui plaisent
LD54:,aux clients
LD54:,aux consommateurs
LD54:,le parfum devait plaire aussi
LD54:,mais c'était aussi le concept qui devait plaire euh
LD54:,et sortir du produit basique
LD54:,donc plus compliqué à faire
LD54:,je pense
LD54:,les produits Rabanne
LD54:,que des produits euh LVMH
ch_NS3:,hm hm
ch_NS3:,d'accord
ch_NS3:,et donc euh
ch_NS3:,donc après vous avez été licencié
ch_NS3:,économique
LD54:,oui
ch_NS3:,et donc vous avez dû changer euh
ch_NS3:,totalement de
LD54:,non
LD54:,euh j'ai voulu euh absolument
LD54:,poursuivre ce genre d'activité
LD54:,pendant un an
LD54:,vous vous avez vos repères vous avez vos
LD54:,votre réseau
ch_NS3:,hm hm
LD54:,et au bout d'un an euh vous vous rendez compte
LD54:,que votre réseau euh
LD54:,de moins en moins euh
LD54:,il est il est bon
LD54:,de moins en moins il est efficace euh
LD54:,et vous avez euh
LD54:,des entretiens et vous vous rendez compte euh
LD54:,que quand vous postulez à des postes euh
LD54:,de chef de projets euh on vous dit
LD54:,mais vous étiez euh
LD54:,autrement
LD54:,différent
